{
  "$schema": "./chains.schema.json",
  "version": 1,
  "about": "National and large regional US chain brands that show up as Qloo places (coffee, fast food, casual dining, sports bars, retail, book stores, barbers and salons). A hand-kept list, reviewed by hand: a chain that is not on it ranks as a local place. Partner and pre/post lists put these after local places; nothing on the list is dropped.",
  "reviewedAt": "2026-10-20",
  "chains": [
    {"name":"Starbucks","aliases":["Starbucks Coffee","Starbucks Coffee Company","Starbucks Reserve"],"kind":"coffee"},
    {"name":"Dunkin'","aliases":["Dunkin' Donuts"],"kind":"coffee"},
    {"name":"Peet's Coffee","aliases":["Peet's Coffee & Tea"],"kind":"coffee"},
    {"name":"Caribou Coffee","kind":"coffee"},
    {"name":"Tim Hortons","kind":"coffee"},
    {"name":"Dutch Bros Coffee","aliases":["Dutch Bros"],"kind":"coffee"},
    {"name":"Blue Bottle Coffee","kind":"coffee"},
    {"name":"The Coffee Bean & Tea Leaf","kind":"coffee"},
    {"name":"Joe & The Juice","kind":"coffee"},
    {"name":"Pret A Manger","kind":"coffee"},
    {"name":"Kung Fu Tea","kind":"coffee"},
    {"name":"Gong Cha","kind":"coffee"},
    {"name":"Tropical Smoothie Cafe","aliases":["Tropical Smoothie"],"kind":"coffee"},
    {"name":"Smoothie King","kind":"coffee"},
    {"name":"Jamba","aliases":["Jamba Juice"],"kind":"coffee"},
    {"name":"Panera Bread","aliases":["Panera"],"kind":"bakery_dessert"},
    {"name":"Au Bon Pain","kind":"bakery_dessert"},
    {"name":"Corner Bakery Cafe","aliases":["Corner Bakery"],"kind":"bakery_dessert"},
    {"name":"Le Pain Quotidien","kind":"bakery_dessert"},
    {"name":"Paris Baguette","kind":"bakery_dessert"},
    {"name":"85°C Bakery Cafe","aliases":["85C Bakery Cafe"],"kind":"bakery_dessert"},
    {"name":"Krispy Kreme","aliases":["Krispy Kreme Doughnuts"],"kind":"bakery_dessert"},
    {"name":"Insomnia Cookies","kind":"bakery_dessert"},
    {"name":"Crumbl Cookies","aliases":["Crumbl"],"kind":"bakery_dessert"},
    {"name":"Nothing Bundt Cakes","kind":"bakery_dessert"},
    {"name":"Cinnabon","kind":"bakery_dessert"},
    {"name":"Auntie Anne's","kind":"bakery_dessert"},
    {"name":"Baskin-Robbins","kind":"bakery_dessert"},
    {"name":"Dairy Queen","aliases":["DQ Grill & Chill"],"kind":"bakery_dessert"},
    {"name":"Cold Stone Creamery","kind":"bakery_dessert"},
    {"name":"Rita's Italian Ice","aliases":["Rita's Italian Ice & Frozen Custard"],"kind":"bakery_dessert"},
    {"name":"Menchie's Frozen Yogurt","aliases":["Menchie's"],"kind":"bakery_dessert"},
    {"name":"sweetFrog","aliases":["sweetFrog Premium Frozen Yogurt"],"kind":"bakery_dessert"},
    {"name":"Ben & Jerry's","kind":"bakery_dessert"},
    {"name":"Einstein Bros. Bagels","aliases":["Einstein Bros Bagels","Einstein Bagels"],"kind":"bakery_dessert"},
    {"name":"McDonald's","kind":"fast_food"},
    {"name":"Burger King","kind":"fast_food"},
    {"name":"Wendy's","kind":"fast_food"},
    {"name":"Taco Bell","kind":"fast_food"},
    {"name":"KFC","aliases":["Kentucky Fried Chicken"],"kind":"fast_food"},
    {"name":"Popeyes Louisiana Kitchen","aliases":["Popeyes"],"kind":"fast_food"},
    {"name":"Chick-fil-A","kind":"fast_food"},
    {"name":"Arby's","kind":"fast_food"},
    {"name":"Sonic Drive-In","kind":"fast_food"},
    {"name":"Jack in the Box","kind":"fast_food"},
    {"name":"Culver's","kind":"fast_food"},
    {"name":"Steak 'n Shake","kind":"fast_food"},
    {"name":"Checkers","kind":"fast_food"},
    {"name":"Rally's","kind":"fast_food"},
    {"name":"White Castle","kind":"fast_food"},
    {"name":"Zaxby's","kind":"fast_food"},
    {"name":"Raising Cane's","aliases":["Raising Cane's Chicken Fingers"],"kind":"fast_food"},
    {"name":"Bojangles","aliases":["Bojangles' Famous Chicken 'n Biscuits"],"kind":"fast_food"},
    {"name":"Church's Chicken","aliases":["Church's Texas Chicken"],"kind":"fast_food"},
    {"name":"Wingstop","kind":"fast_food"},
    {"name":"Panda Express","kind":"fast_food"},
    {"name":"Subway","kind":"fast_food"},
    {"name":"Jersey Mike's Subs","aliases":["Jersey Mike's"],"kind":"fast_food"},
    {"name":"Jimmy John's","kind":"fast_food"},
    {"name":"Firehouse Subs","kind":"fast_food"},
    {"name":"Quiznos","kind":"fast_food"},
    {"name":"Which Wich","aliases":["Which Wich Superior Sandwiches"],"kind":"fast_food"},
    {"name":"Jerry's Subs & Pizza","aliases":["Jerry's Subs"],"kind":"fast_food"},
    {"name":"Five Guys","aliases":["Five Guys Burgers and Fries"],"kind":"fast_food"},
    {"name":"Shake Shack","kind":"fast_food"},
    {"name":"Smashburger","kind":"fast_food"},
    {"name":"The Habit Burger Grill","aliases":["Habit Burger"],"kind":"fast_food"},
    {"name":"Chipotle Mexican Grill","aliases":["Chipotle"],"kind":"fast_casual"},
    {"name":"Qdoba Mexican Eats","aliases":["Qdoba","Qdoba Mexican Grill"],"kind":"fast_casual"},
    {"name":"Moe's Southwest Grill","kind":"fast_casual"},
    {"name":"Baja Fresh","kind":"fast_casual"},
    {"name":"CAVA","kind":"fast_casual"},
    {"name":"Sweetgreen","kind":"fast_casual"},
    {"name":"Chopt Creative Salad Co.","aliases":["Chopt"],"kind":"fast_casual"},
    {"name":"Just Salad","kind":"fast_casual"},
    {"name":"Noodles & Company","kind":"fast_casual"},
    {"name":"Potbelly","aliases":["Potbelly Sandwich Shop","Potbelly Sandwich Works"],"kind":"fast_casual"},
    {"name":"Jason's Deli","kind":"fast_casual"},
    {"name":"McAlister's Deli","kind":"fast_casual"},
    {"name":"Schlotzsky's","kind":"fast_casual"},
    {"name":"Cosi","kind":"fast_casual","exact":true},
    {"name":"Boston Market","kind":"fast_casual"},
    {"name":"Nando's","aliases":["Nando's Peri-Peri"],"kind":"fast_casual"},
    {"name":"Honeygrow","kind":"fast_casual"},
    {"name":"Pollo Campero","kind":"fast_casual"},
    {"name":"Bonchon","aliases":["Bonchon Chicken"],"kind":"fast_casual"},
    {"name":"Wawa","kind":"fast_casual"},
    {"name":"Sheetz","kind":"fast_casual"},
    {"name":"7-Eleven","kind":"fast_casual"},
    {"name":"Domino's","aliases":["Domino's Pizza"],"kind":"pizza"},
    {"name":"Pizza Hut","kind":"pizza"},
    {"name":"Papa John's","aliases":["Papa Johns Pizza"],"kind":"pizza"},
    {"name":"Little Caesars","aliases":["Little Caesars Pizza"],"kind":"pizza"},
    {"name":"Marco's Pizza","kind":"pizza"},
    {"name":"Sbarro","kind":"pizza"},
    {"name":"Mellow Mushroom","kind":"pizza"},
    {"name":"MOD Pizza","kind":"pizza"},
    {"name":"Blaze Pizza","kind":"pizza"},
    {"name":"&pizza","kind":"pizza"},
    {"name":"Uno Pizzeria & Grill","aliases":["Pizzeria Uno"],"kind":"pizza"},
    {"name":"California Pizza Kitchen","kind":"pizza"},
    {"name":"Applebee's","aliases":["Applebee's Grill + Bar"],"kind":"casual_dining"},
    {"name":"Chili's","aliases":["Chili's Grill & Bar"],"kind":"casual_dining"},
    {"name":"Olive Garden","aliases":["Olive Garden Italian Restaurant"],"kind":"casual_dining"},
    {"name":"Outback Steakhouse","kind":"casual_dining"},
    {"name":"Red Lobster","kind":"casual_dining"},
    {"name":"Red Robin","aliases":["Red Robin Gourmet Burgers"],"kind":"casual_dining"},
    {"name":"TGI Fridays","aliases":["TGI Friday's","T.G.I. Friday's"],"kind":"casual_dining"},
    {"name":"Ruby Tuesday","kind":"casual_dining"},
    {"name":"Texas Roadhouse","kind":"casual_dining"},
    {"name":"LongHorn Steakhouse","kind":"casual_dining"},
    {"name":"The Cheesecake Factory","kind":"casual_dining"},
    {"name":"P.F. Chang's","kind":"casual_dining"},
    {"name":"Maggiano's Little Italy","aliases":["Maggiano's"],"kind":"casual_dining"},
    {"name":"Carrabba's Italian Grill","kind":"casual_dining"},
    {"name":"Bonefish Grill","kind":"casual_dining"},
    {"name":"Cracker Barrel","aliases":["Cracker Barrel Old Country Store"],"kind":"casual_dining"},
    {"name":"IHOP","kind":"casual_dining"},
    {"name":"Denny's","kind":"casual_dining"},
    {"name":"Waffle House","kind":"casual_dining"},
    {"name":"Bob Evans","kind":"casual_dining"},
    {"name":"First Watch","kind":"casual_dining"},
    {"name":"Perkins Restaurant & Bakery","kind":"casual_dining"},
    {"name":"Golden Corral","kind":"casual_dining"},
    {"name":"Cheddar's Scratch Kitchen","kind":"casual_dining"},
    {"name":"Hard Rock Cafe","kind":"casual_dining"},
    {"name":"Uncle Julio's","kind":"casual_dining"},
    {"name":"Seasons 52","kind":"casual_dining"},
    {"name":"Ruth's Chris Steak House","kind":"casual_dining"},
    {"name":"Morton's The Steakhouse","kind":"casual_dining"},
    {"name":"The Capital Grille","kind":"casual_dining"},
    {"name":"Fogo de Chão","kind":"casual_dining"},
    {"name":"Chuck E. Cheese","kind":"casual_dining"},
    {"name":"Hooters","kind":"sports_bar"},
    {"name":"Twin Peaks","kind":"sports_bar"},
    {"name":"Buffalo Wild Wings","aliases":["BWW","B-Dubs"],"kind":"sports_bar"},
    {"name":"Bar Louie","kind":"sports_bar"},
    {"name":"World of Beer","kind":"sports_bar"},
    {"name":"Yard House","kind":"sports_bar"},
    {"name":"Miller's Ale House","kind":"sports_bar"},
    {"name":"BJ's Restaurant & Brewhouse","aliases":["BJ's Restaurant"],"kind":"sports_bar"},
    {"name":"Glory Days Grill","kind":"sports_bar"},
    {"name":"Dave & Buster's","kind":"sports_bar"},
    {"name":"Topgolf","kind":"sports_bar"},
    {"name":"Ross Dress for Less","aliases":["Ross Stores"],"kind":"retail"},
    {"name":"T.J. Maxx","aliases":["TJ Maxx"],"kind":"retail"},
    {"name":"Marshalls","kind":"retail"},
    {"name":"HomeGoods","kind":"retail"},
    {"name":"Burlington","aliases":["Burlington Coat Factory"],"kind":"retail","exact":true},
    {"name":"Target","kind":"retail","exact":true},
    {"name":"Walmart","aliases":["Walmart Supercenter"],"kind":"retail"},
    {"name":"Old Navy","kind":"retail"},
    {"name":"Gap","aliases":["Gap Factory"],"kind":"retail","exact":true},
    {"name":"Banana Republic","kind":"retail"},
    {"name":"H&M","kind":"retail"},
    {"name":"Zara","kind":"retail"},